campaign_id,campaign_url,total_products_count,unique_products_count,brand_name,subcategories,end_date_text,extraction_timestamp
894182,https://es.privalia.com/gr/catalog/894182,260,235,"Adidas Adidas, la mezcla perfecta entre deporte y moda","Gazelle, Calzado - Originals, Campus, Taekwondo, Country, modelos similares, SL, Adiletten y sandalias, Superstar, Stan Smith, Court, modelos similares, Samba, Forum, Rivalry, modelos similares, NMD, Ozweego, modelos similares, Handball Special, Mujer - Performance, Camisetas, Sudaderas, chaquetas y conjuntos, Pantalones jogger y outdoor, Running, Leggings y mallas, Sujetadores deportivos, ropa interior, Ropa de golf, Shorts y leggings ciclista, Chaquetas y chalecos para exterior, Fútbol - Ropa, Terrex - Ropa, Chaquetas, Polos, camisetas, tops, Natación, Mujer - Originals y lifestyle, Camisetas, Pantalones jogger, pantalones, Shorts y leggings ciclista, Sudaderas, chaquetas y jerséis, Camisetas y tops, Chaquetas y chalecos, Vestidos, faldas y monos, Todos los productos disponibles, Zapatos - Performance, Running, Entrenamiento, baloncesto, otros deportes, Adizero, Swift Run, Rapidmove, Fútbol, Terrex, Outdoor, Todos los productos disponibles, Infantil - Originals, ropa deportiva y accesorios, Camisetas, Sudaderas, chaquetas y jerséis, Pantalones jogger, Mochilas, gorras y calcetines, Ropa y accesorios de fútbol, Chándals, conjuntos, Pantalones cortos, leggings, Chaquetas y chalecos, Polos, camisetas, tops, Natación, Vestidos, faldas y monos, Hombre - Originals y lifestyle, Camisetas, Pantalones jogger, Sudaderas, chaquetas y jerséis, Shorts, ropa interior, Chaquetas y chalecos, Polos, camisetas, tops, camisas, Pantalones cargo, chinos, vaqueros, Todos los productos disponibles, Hombre - Performance, Camisetas, Pantalones de jogging y mallas, Sudaderas, chaquetas y conjuntos, Fútbol - Ropa de abrigo, Shorts y leggings ciclista, Running, Natación, Ropa de golf, Chaquetas y chalecos para exterior, Polos, camisetas, tops, Fútbol - Ropa interior, calcetines, Terrex - Ropa, Chaquetas, Material deportivo, calcetines y accesorios, Calcetines, Mochilas, bolsos y riñoneras, Gorras, sombreros, cintas para el pelo, Balones de fútbol, guantes y espinilleras, Equipamiento deportivo y accesorios, Gorros, guantes y bufandas, Relojes de pulsera, gafas de sol, Todos los productos disponibles, Infantil - calzado, Zapatillas, Iconics, Calzado deportivo, Adiletten, sandalias, Fútbol, Todos los productos disponibles, Calzado - Originals, Campus, Taekwondo, Country, modelos similares, SL, Adiletten y sandalias, Superstar, Stan Smith, Court, modelos similares, Samba, Forum, Rivalry, modelos similares, NMD, Ozweego, modelos similares, Handball Special, Mujer - Performance, Camisetas, Sudaderas, chaquetas y conjuntos, Pantalones jogger y outdoor, Running, Leggings y mallas, Sujetadores deportivos, ropa interior, Ropa de golf, Shorts y leggings ciclista, Chaquetas y chalecos para exterior, Fútbol - Ropa, Terrex - Ropa, Chaquetas, Polos, camisetas, tops, Natación, Mujer - Originals y lifestyle, Camisetas, Pantalones jogger, pantalones, Shorts y leggings ciclista, Sudaderas, chaquetas y jerséis, Camisetas y tops, Chaquetas y chalecos, Vestidos, faldas y monos, Todos los productos disponibles, Zapatos - Performance, Running, Entrenamiento, baloncesto, otros deportes, Adizero, Swift Run, Rapidmove, Fútbol, Terrex, Outdoor, Todos los productos disponibles, Infantil - Originals, ropa deportiva y accesorios, Camisetas, Sudaderas, chaquetas y jerséis, Pantalones jogger, Mochilas, gorras y calcetines, Ropa y accesorios de fútbol, Chándals, conjuntos, Pantalones cortos, leggings, Chaquetas y chalecos, Polos, camisetas, tops, Natación, Vestidos, faldas y monos, Hombre - Originals y lifestyle, Camisetas, Pantalones jogger, Sudaderas, chaquetas y jerséis, Shorts, ropa interior, Chaquetas y chalecos, Polos, camisetas, tops, camisas, Pantalones cargo, chinos, vaqueros, Todos los productos disponibles, Hombre - Performance, Camisetas, Pantalones de jogging y mallas, Sudaderas, chaquetas y conjuntos, Fútbol - Ropa de abrigo, Shorts y leggings ciclista, Running, Natación, Ropa de golf, Chaquetas y chalecos para exterior, Polos, camisetas, tops, Fútbol - Ropa interior, calcetines, Terrex - Ropa, Chaquetas, Material deportivo, calcetines y accesorios, Calcetines, Mochilas, bolsos y riñoneras, Gorras, sombreros, cintas para el pelo, Balones de fútbol, guantes y espinilleras, Equipamiento deportivo y accesorios, Gorros, guantes y bufandas, Relojes de pulsera, gafas de sol, Todos los productos disponibles, Infantil - calzado, Zapatillas, Iconics, Calzado deportivo, Adiletten, sandalias, Fútbol, Todos los productos disponibles, Calzado - Originals, Campus, Taekwondo, Country, modelos similares, SL, Adiletten y sandalias, Superstar, Stan Smith, Court, modelos similares, Samba, Forum, Rivalry, modelos similares, NMD, Ozweego, modelos similares, Handball Special, Mujer - Performance, Camisetas, Sudaderas, chaquetas y conjuntos, Pantalones jogger y outdoor, Running, Leggings y mallas, Sujetadores deportivos, ropa interior, Ropa de golf, Shorts y leggings ciclista, Chaquetas y chalecos para exterior, Fútbol - Ropa, Terrex - Ropa, Chaquetas, Polos, camisetas, tops, Natación, Mujer - Originals y lifestyle, Camisetas, Pantalones jogger, pantalones, Shorts y leggings ciclista, Sudaderas, chaquetas y jerséis, Camisetas y tops, Chaquetas y chalecos, Vestidos, faldas y monos, Todos los productos disponibles, Zapatos - Performance, Running, Entrenamiento, baloncesto, otros deportes, Adizero, Swift Run, Rapidmove, Fútbol, Terrex, Outdoor, Todos los productos disponibles, Infantil - Originals, ropa deportiva y accesorios, Camisetas, Sudaderas, chaquetas y jerséis, Pantalones jogger, Mochilas, gorras y calcetines, Ropa y accesorios de fútbol, Chándals, conjuntos, Pantalones cortos, leggings, Chaquetas y chalecos, Polos, camisetas, tops, Natación, Vestidos, faldas y monos, Hombre - Originals y lifestyle, Camisetas, Pantalones jogger, Sudaderas, chaquetas y jerséis, Shorts, ropa interior, Chaquetas y chalecos, Polos, camisetas, tops, camisas, Pantalones cargo, chinos, vaqueros, Todos los productos disponibles, Hombre - Performance, Camisetas, Pantalones de jogging y mallas, Sudaderas, chaquetas y conjuntos, Fútbol - Ropa de abrigo, Shorts y leggings ciclista, Running, Natación, Ropa de golf, Chaquetas y chalecos para exterior, Polos, camisetas, tops, Fútbol - Ropa interior, calcetines, Terrex - Ropa, Chaquetas, Material deportivo, calcetines y accesorios, Calcetines, Mochilas, bolsos y riñoneras, Gorras, sombreros, cintas para el pelo, Balones de fútbol, guantes y espinilleras, Equipamiento deportivo y accesorios, Gorros, guantes y bufandas, Relojes de pulsera, gafas de sol, Todos los productos disponibles, Infantil - calzado, Zapatillas, Iconics, Calzado deportivo, Adiletten, sandalias, Fútbol, Todos los productos disponibles, Calzado - Originals, Samba, Handball Special, Campus, SL, Taekwondo, Country, modelos similares, Forum, Rivalry, modelos similares, Superstar, Stan Smith, Court, modelos similares, NMD, Ozweego, modelos similares, Adiletten y sandalias, Mira todas las categorias","hasta el domingo, 12 de abril de 2026 8:00 adidas, la mezcla perfecta entre deporte y moda productos centrados en el estilo de vida y el rendimiento para mujeres, hombres y niños. con la ropa deportiva elegante de adidas, muestra al mundo que siempre estás buscando nuevos desafíos. añadir a mis favoritos y recibir una alerta",2026-04-05 11:10:56
898949,https://es.privalia.com/gr/catalog/898949,165,110,Gaston & Hortense,"Tumbonas y sillas relax, Muebles de jardín, Mesas y sillas, Alfombras, Juegos de muebles de jardín, Hamacas y balancines, Cocinas al aire libre, Todos los productos disponibles, Pérgolas, sombrillas y toldos, Mallas de ocultación y paravientos, Toldos, Pérgolas, Parasoles y toldos, Toldos y puertas, Todos los productos disponibles, Jardinería y almacenamiento, Cobertizos y almacenaje, Huertos y jardineras, Bordillos, Fundas de protección y lonas, Herramientas y materiales, Invernaderos, Todos los productos disponibles, Espacio animal, Perros y gatos, Gallinas y conejos, Todos los productos disponibles, Muebles de jardín, Mesas y sillas, Alfombras, Juegos de muebles de jardín, Hamacas y balancines, Cocinas al aire libre, Todos los productos disponibles, Pérgolas, sombrillas y toldos, Mallas de ocultación y paravientos, Toldos, Pérgolas, Parasoles y toldos, Toldos y puertas, Todos los productos disponibles, Jardinería y almacenamiento, Cobertizos y almacenaje, Huertos y jardineras, Bordillos, Fundas de protección y lonas, Herramientas y materiales, Invernaderos, Todos los productos disponibles, Espacio animal, Perros y gatos, Gallinas y conejos, Todos los productos disponibles, Muebles de jardín, Mesas y sillas, Alfombras, Juegos de muebles de jardín, Hamacas y balancines, Cocinas al aire libre, Todos los productos disponibles, Pérgolas, sombrillas y toldos, Mallas de ocultación y paravientos, Toldos, Pérgolas, Parasoles y toldos, Toldos y puertas, Todos los productos disponibles, Jardinería y almacenamiento, Cobertizos y almacenaje, Huertos y jardineras, Bordillos, Fundas de protección y lonas, Herramientas y materiales, Invernaderos, Todos los productos disponibles, Espacio animal, Perros y gatos, Gallinas y conejos, Todos los productos disponibles, Muebles de jardín, Mesas y sillas, Juegos de muebles de jardín, Cocinas al aire libre, Hamacas y balancines, Alfombras, Mira todas las categorias","hasta el jueves, 9 de abril de 2026 6:00 apasionado por la naturaleza y la jardinería, gaston selecciona los mejores productos de diseño de jardines para usted. añadir a mis favoritos y recibir una alerta",2026-04-05 11:10:56
896972,https://es.privalia.com/gr/catalog/896972,0,0,"OVS ¡Estilo moderno e informal para niños, mujeres y hombres!",,"hasta el viernes, 10 de abril de 2026 6:00 ¡estilo moderno e informal para niños, mujeres y hombres! ovs s.p.a. es líder italiano en ropa para mujer, hombre y niño, con una cuota de mercado del 8,1%. opera más de 1750 tiendas en italia y en el extranjero bajo las marcas ovs y upim. cotiza en la bolsa de valores de italia desde marzo de 2015. añadir a mis favoritos y recibir una alerta",2026-04-05 11:10:56
v1,https://es.privalia.com/web/catalog/v1/sale/903925/redirect,10,10,Marruecos: Circuitos + Vuelos,,"hasta el miércoles, 8 de abril de 2026 6:00 escápate al país vecino y disfruta de paisajes y sabores nuevos que harán de tu viaje una experiencia inolvidable. descubre marrakech y su poderío cultural y arquitectónico y pon rumbo al sur del país donde podrás, por ejemplo, dormir en el desierto.",2026-04-05 11:10:56
887369,https://es.privalia.com/gr/catalog/887369,260,246,BOSS para mujeres y hombres,"Camisetas y camisas, Hombre - ropa, Pantalones, Polos, Bermudas, shorts y shorts de baño, Jeans, Ropa deportiva, Camisas - Casual, Ropa de exterior, Sudaderas, Jerséis y cárdigans, Jerséis, cárdigans 100% lana, Hombre - zapatos, accesorios y ropa Interior, Ropa interior, calcetines, Pijamas, ropa de casa y pantalones jogger, Sneakers, Cinturones, Bolsos, mochilas, pequeños artículos de cuero, Gorras, gorros y sombreros, Sandalias, chanclas, pantuflas, Guantes, Bufandas, chales, Mocasines, Botines, Oficina y ocasiones especiales - Hombres, Camisas - Business, Trajes - Mix & Match, Derbys, Richelieus, Mocasines, Trajes - 2 y 3 piezas, Americanas y chalecos, Corbatas, pajaritas y pañuelos de bolsillo, Joyas, gemelos y pasadores de corbata, Mujer - ropa, Camisetas, camisas y polos, Blusas y tops, Jerséis y cárdigans, Pantalones, Sudaderas y sudaderas con capucha, Ropa de exterior, Faldas y shorts, Jeans, Oficina y ocasiones especiales - Mujer, Vestidos y monos, Blusas y tops, Pantalones, Blazers, Zapatos de tacón, sandalias, Todos los productos disponibles, Mujer - zapatos, accesorios y lencería, Sneakers, Bolsos, Bufandas, gorros, guantes, Ropa interior, ropa de estar por casa, ropa de dormir, Ropa de baño, Sandalias y alpargatas, Cinturones, pequeños artículos de cuero, Botines y botas, Bailarinas, mocasines, Accesorios decorativos, Todos los productos disponibles, Hombre - ropa, Pantalones, Polos, Bermudas, shorts y shorts de baño, Jeans, Ropa deportiva, Camisas - Casual, Ropa de exterior, Sudaderas, Jerséis y cárdigans, Jerséis, cárdigans 100% lana, Hombre - zapatos, accesorios y ropa Interior, Ropa interior, calcetines, Pijamas, ropa de casa y pantalones jogger, Sneakers, Cinturones, Bolsos, mochilas, pequeños artículos de cuero, Gorras, gorros y sombreros, Sandalias, chanclas, pantuflas, Guantes, Bufandas, chales, Mocasines, Botines, Oficina y ocasiones especiales - Hombres, Camisas - Business, Trajes - Mix & Match, Derbys, Richelieus, Mocasines, Trajes - 2 y 3 piezas, Americanas y chalecos, Corbatas, pajaritas y pañuelos de bolsillo, Joyas, gemelos y pasadores de corbata, Mujer - ropa, Camisetas, camisas y polos, Blusas y tops, Jerséis y cárdigans, Pantalones, Sudaderas y sudaderas con capucha, Ropa de exterior, Faldas y shorts, Jeans, Oficina y ocasiones especiales - Mujer, Vestidos y monos, Blusas y tops, Pantalones, Blazers, Zapatos de tacón, sandalias, Todos los productos disponibles, Mujer - zapatos, accesorios y lencería, Sneakers, Bolsos, Bufandas, gorros, guantes, Ropa interior, ropa de estar por casa, ropa de dormir, Ropa de baño, Sandalias y alpargatas, Cinturones, pequeños artículos de cuero, Botines y botas, Bailarinas, mocasines, Accesorios decorativos, Todos los productos disponibles, 2, Hombre - ropa, Pantalones, Polos, Bermudas, shorts y shorts de baño, Jeans, Ropa deportiva, Camisas - Casual, Ropa de exterior, Sudaderas, Jerséis y cárdigans, Jerséis, cárdigans 100% lana, Hombre - zapatos, accesorios y ropa Interior, Ropa interior, calcetines, Pijamas, ropa de casa y pantalones jogger, Sneakers, Cinturones, Bolsos, mochilas, pequeños artículos de cuero, Gorras, gorros y sombreros, Sandalias, chanclas, pantuflas, Guantes, Bufandas, chales, Mocasines, Botines, Oficina y ocasiones especiales - Hombres, Camisas - Business, Trajes - Mix & Match, Derbys, Richelieus, Mocasines, Trajes - 2 y 3 piezas, Americanas y chalecos, Corbatas, pajaritas y pañuelos de bolsillo, Joyas, gemelos y pasadores de corbata, Mujer - ropa, Camisetas, camisas y polos, Blusas y tops, Jerséis y cárdigans, Pantalones, Sudaderas y sudaderas con capucha, Ropa de exterior, Faldas y shorts, Jeans, Oficina y ocasiones especiales - Mujer, Vestidos y monos, Blusas y tops, Pantalones, Blazers, Zapatos de tacón, sandalias, Todos los productos disponibles, Mujer - zapatos, accesorios y lencería, Sneakers, Bolsos, Bufandas, gorros, guantes, Ropa interior, ropa de estar por casa, ropa de dormir, Ropa de baño, Sandalias y alpargatas, Cinturones, pequeños artículos de cuero, Botines y botas, Bailarinas, mocasines, Accesorios decorativos, Todos los productos disponibles, Hombre - ropa, Camisas - Casual, Jerséis, cárdigans 100% lana, Polos, Ropa de exterior, Pantalones, Jerséis y cárdigans, Sudaderas, Jeans, Ropa deportiva, Bermudas, shorts y shorts de baño, Mira todas las categorias, 2","hasta el lunes, 6 de abril de 2026 23:59 para mujeres y hombres boss es una marca de moda internacional que se distingue por su elegancia atemporal, materiales de alta calidad y diseños innovadores. combina ropa de negocios con estilo, prendas casuales modernas y conjuntos deportivos, reflejando confianza en uno mismo, calidad y un estilo de vida urbano. añadir a mis favoritos y recibir una alerta",2026-04-05 11:10:56
899530,https://es.privalia.com/gr/catalog/899530,245,98,Ropa de hombre,"Prendas de punto, Conjuntos y trajes, Polos y camisetas, Pantalones y bermudas, Camisas, Ropa de abrigo, Blazers y chalecos, Calzado, accesorios y ropa de playa, Conjuntos y trajes, Polos y camisetas, Pantalones y bermudas, Camisas, Ropa de abrigo, Blazers y chalecos, Calzado, accesorios y ropa de playa, Conjuntos y trajes, Polos y camisetas, Pantalones y bermudas, Camisas, Ropa de abrigo, Blazers y chalecos, Calzado, accesorios y ropa de playa, Conjuntos y trajes, Blazers y chalecos, Ropa de abrigo, Camisas, Polos y camisetas, Pantalones y bermudas, Calzado, accesorios y ropa de playa, Mira todas las categorias","hasta el martes, 7 de abril de 2026 6:00 ropa de hombre dan john nació en roma con el proyecto de convertirse en una realidad internacional de la moda masculina, con más de 140 tiendas en italia y en el extranjero. añadir a mis favoritos y recibir una alerta",2026-04-05 11:10:56
897707,https://es.privalia.com/gr/catalog/897707,233,142,"WMF Innovación alemana en tu cocina: calidad, diseño y precisión WMF.","Utensilios, Preparar, Cuchillos, tijeras y accesorios de corte, Accesorios, Repostería y panadería, Todos los productos disponibles, Servicio de mesa y para llevar, Cubertería, Para la mesa, Especial Infantil, Para llevar, Todos los productos disponibles, Cocinar, Cocción y fritura, Baterías, Ollas rápidas, Todos los productos disponibles, Pequeño electrodoméstico, Cocción y conservación de alimentos, Batidoras y licuadoras, Grills y tostadoras, Hervidores y cafeteras, Todos los productos disponibles, Preparar, Cuchillos, tijeras y accesorios de corte, Accesorios, Repostería y panadería, Todos los productos disponibles, Servicio de mesa y para llevar, Cubertería, Para la mesa, Especial Infantil, Para llevar, Todos los productos disponibles, Cocinar, Cocción y fritura, Baterías, Ollas rápidas, Todos los productos disponibles, Pequeño electrodoméstico, Cocción y conservación de alimentos, Batidoras y licuadoras, Grills y tostadoras, Hervidores y cafeteras, Todos los productos disponibles, Preparar, Cuchillos, tijeras y accesorios de corte, Accesorios, Repostería y panadería, Todos los productos disponibles, Servicio de mesa y para llevar, Cubertería, Para la mesa, Especial Infantil, Para llevar, Todos los productos disponibles, Cocinar, Cocción y fritura, Baterías, Ollas rápidas, Todos los productos disponibles, Pequeño electrodoméstico, Cocción y conservación de alimentos, Batidoras y licuadoras, Grills y tostadoras, Hervidores y cafeteras, Todos los productos disponibles, Preparar, Cuchillos, tijeras y accesorios de corte, Accesorios, Repostería y panadería, Mira todas las categorias","hasta el martes, 7 de abril de 2026 6:00 innovación alemana en tu cocina: calidad, diseño y precisión wmf. wmf es sinónimo de excelencia alemana en la cocina desde 1853. reconocida por su calidad, precisión e innovación, ofrece utensilios y electrodomésticos de diseño elegante y duradero. cada producto wmf transforma la cocina diaria en una experiencia gourmet, combinando funcionalidad profesional y estilo moderno. añadir a mis favoritos y recibir una alerta",2026-04-05 11:10:56
896572,https://es.privalia.com/gr/catalog/896572,219,180,Polo Club,"Camisetas, Hombre, Polos, Packs, Jerséis y cárdigans - tonos oscuros, Camisas, Sudaderas, Pantalones y bermudas, Jerséis y cárdigans - tonos claros, Bolsos y accesorios, Chaquetas, chalecos y abrigos, Todos los productos disponibles, Mujer, Camisetas y tops, Jerséis y cárdigans, Camisas, Sudaderas, Polos, Chaquetas, chalecos y abrigos, Packs, Calzado y accesorios, Pantalones, shorts y faldas, Vestidos, Todos los productos disponibles, Hombre, Polos, Packs, Jerséis y cárdigans - tonos oscuros, Camisas, Sudaderas, Pantalones y bermudas, Jerséis y cárdigans - tonos claros, Bolsos y accesorios, Chaquetas, chalecos y abrigos, Todos los productos disponibles, Mujer, Camisetas y tops, Jerséis y cárdigans, Camisas, Sudaderas, Polos, Chaquetas, chalecos y abrigos, Packs, Calzado y accesorios, Pantalones, shorts y faldas, Vestidos, Todos los productos disponibles, 2, Hombre, Polos, Packs, Jerséis y cárdigans - tonos oscuros, Camisas, Sudaderas, Pantalones y bermudas, Jerséis y cárdigans - tonos claros, Bolsos y accesorios, Chaquetas, chalecos y abrigos, Todos los productos disponibles, Mujer, Camisetas y tops, Jerséis y cárdigans, Camisas, Sudaderas, Polos, Chaquetas, chalecos y abrigos, Packs, Calzado y accesorios, Pantalones, shorts y faldas, Vestidos, Todos los productos disponibles, Hombre, Packs, Polos, Jerséis y cárdigans - tonos oscuros, Jerséis y cárdigans - tonos claros, Chaquetas, chalecos y abrigos, Sudaderas, Camisas, Pantalones y bermudas, Bolsos y accesorios, Mira todas las categorias, 2","hasta el jueves, 9 de abril de 2026 6:00 polo club polo club es una marca para hombres, mujeres y niños con un diseño atemporal que combina la elegancia con los valores del deporte del polo para crear prendas con las que vestir en cualquier ocasión. añadir a mis favoritos y recibir una alerta",2026-04-05 11:10:56
896105,https://es.privalia.com/gr/catalog/896105,120,102,Bayton,"Sandalias de dos tiras, Mujer, Sandalias de una tira, Sandalias con tira entre los dedos, Sandalias de cuña, Sandalias de múltiples tiras, Las originales, Sandalias con plataforma, Zuecos, Colección Otoño/Invierno, Colección vegana, Hombre, Sandalias de dos tiras, Sandalias de una tira, Zuecos, Sandalias con tira entre los dedos, Sandalias de múltiples tiras, Colección Otoño/Invierno, Colección vegana, Todos los productos disponibles, Infantil, Sandalias de múltiples tiras, Sandalias de dos tiras, Sandalias con una tira y entre los dedos, Colección Otoño/Invierno, Todos los productos disponibles, Accesorios, Mujer, Sandalias de una tira, Sandalias con tira entre los dedos, Sandalias de cuña, Sandalias de múltiples tiras, Las originales, Sandalias con plataforma, Zuecos, Colección Otoño/Invierno, Colección vegana, Hombre, Sandalias de dos tiras, Sandalias de una tira, Zuecos, Sandalias con tira entre los dedos, Sandalias de múltiples tiras, Colección Otoño/Invierno, Colección vegana, Todos los productos disponibles, Infantil, Sandalias de múltiples tiras, Sandalias de dos tiras, Sandalias con una tira y entre los dedos, Colección Otoño/Invierno, Todos los productos disponibles, Accesorios, 2, 3, 4, Mujer, Sandalias de una tira, Sandalias con tira entre los dedos, Sandalias de cuña, Sandalias de múltiples tiras, Las originales, Sandalias con plataforma, Zuecos, Colección Otoño/Invierno, Colección vegana, Hombre, Sandalias de dos tiras, Sandalias de una tira, Zuecos, Sandalias con tira entre los dedos, Sandalias de múltiples tiras, Colección Otoño/Invierno, Colección vegana, Todos los productos disponibles, Infantil, Sandalias de múltiples tiras, Sandalias de dos tiras, Sandalias con una tira y entre los dedos, Colección Otoño/Invierno, Todos los productos disponibles, Accesorios, Mujer, Las originales, Sandalias con plataforma, Sandalias de una tira, Sandalias de múltiples tiras, Sandalias con tira entre los dedos, Sandalias de cuña, Zuecos, Colección vegana, Colección Otoño/Invierno, Mira todas las categorias, 2, 3, 4","hasta el martes, 14 de abril de 2026 6:00 bayton bayton, tu marca favorita de sandalias bio, te presenta su nueva colección de zapatillas para andar por casa. comodidad y tendencia para cada día. añadir a mis favoritos y recibir una alerta",2026-04-05 11:10:56
