campaign_id,campaign_url,total_products_count,unique_products_count,brand_name,subcategories,end_date_text,extraction_timestamp
897576,https://es.privalia.com/gr/catalog/897576,256,247,HUGO Ropa infantil y para bebés,"Camisetas y camisas, Hombre - ropa, Ropa de estar por casa e interior, Jeans, Sudaderas, sudadera con capucha, Pantalones cortos, bermudas, trajes de baño, Polos, Pantalones, Ropa de exterior, Camisas - Business, Trajes - 2 y 3 piezas, Jerséis, cárdigans, chalecos, Camisas - Casual, Americanas y chalecos, Trajes - Mix & Match, Mujer - ropa, Camisetas y camisas, Blusas y tops, Pantalones, Ropa de estar por casa e interior, Vestidos, Ropa de exterior, Jeans, Jerséis, Blazers, Ropa de baño, Sudadera, sudadera con capucha, Faldas y shorts, Hombres - Zapatos, Accesorios, Sneakers, Cinturones, Gorros, bufandas, guantes, Sandalias y mules, Derbies, botines y mocasines, Corbatas, pajaritas y pañuelos de bolsillo, Bolsos y mochilas, Joyas, Todos los productos disponibles, Mujeres - Zapatos, Accesorios, Bolsos y pequeña marroquinería, Sneakers, Sombreros, gorras, bufandas, Zapatos de tacón, sandalias, Bailarinas, mocasines, sandalias, Botines, Todos los productos disponibles, Hombre - ropa, Ropa de estar por casa e interior, Jeans, Sudaderas, sudadera con capucha, Pantalones cortos, bermudas, trajes de baño, Polos, Pantalones, Ropa de exterior, Camisas - Business, Trajes - 2 y 3 piezas, Jerséis, cárdigans, chalecos, Camisas - Casual, Americanas y chalecos, Trajes - Mix & Match, Mujer - ropa, Camisetas y camisas, Blusas y tops, Pantalones, Ropa de estar por casa e interior, Vestidos, Ropa de exterior, Jeans, Jerséis, Blazers, Ropa de baño, Sudadera, sudadera con capucha, Faldas y shorts, Hombres - Zapatos, Accesorios, Sneakers, Cinturones, Gorros, bufandas, guantes, Sandalias y mules, Derbies, botines y mocasines, Corbatas, pajaritas y pañuelos de bolsillo, Bolsos y mochilas, Joyas, Todos los productos disponibles, Mujeres - Zapatos, Accesorios, Bolsos y pequeña marroquinería, Sneakers, Sombreros, gorras, bufandas, Zapatos de tacón, sandalias, Bailarinas, mocasines, sandalias, Botines, Todos los productos disponibles, 2, 3, 4, Hombre - ropa, Ropa de estar por casa e interior, Jeans, Sudaderas, sudadera con capucha, Pantalones cortos, bermudas, trajes de baño, Polos, Pantalones, Ropa de exterior, Camisas - Business, Trajes - 2 y 3 piezas, Jerséis, cárdigans, chalecos, Camisas - Casual, Americanas y chalecos, Trajes - Mix & Match, Mujer - ropa, Camisetas y camisas, Blusas y tops, Pantalones, Ropa de estar por casa e interior, Vestidos, Ropa de exterior, Jeans, Jerséis, Blazers, Ropa de baño, Sudadera, sudadera con capucha, Faldas y shorts, Hombres - Zapatos, Accesorios, Sneakers, Cinturones, Gorros, bufandas, guantes, Sandalias y mules, Derbies, botines y mocasines, Corbatas, pajaritas y pañuelos de bolsillo, Bolsos y mochilas, Joyas, Todos los productos disponibles, Mujeres - Zapatos, Accesorios, Bolsos y pequeña marroquinería, Sneakers, Sombreros, gorras, bufandas, Zapatos de tacón, sandalias, Bailarinas, mocasines, sandalias, Botines, Todos los productos disponibles, Hombre - ropa, Trajes - Mix & Match, Trajes - 2 y 3 piezas, Camisas - Business, Americanas y chalecos, Ropa de exterior, Camisas - Casual, Sudaderas, sudadera con capucha, Polos, Jeans, Pantalones, Jerséis, cárdigans, chalecos, Pantalones cortos, bermudas, trajes de baño, Ropa de estar por casa e interior, Mira todas las categorias, 2, 3, 4","hasta el sábado, 18 de abril de 2026 8:00 ropa infantil y para bebés hugo ofrece a hombres y mujeres un guardarropa con el que pueden componer su propio estilo. añadir a mis favoritos y recibir una alerta",2026-04-05 11:10:56
903885,https://es.privalia.com/gr/catalog/903885,106,29,Cosméticos coreanos,"Medicube, K-secret Seúl 1988, República Natural, Vt Cosmetics, K-secret Seúl 1988, República Natural, Vt Cosmetics, K-secret Seúl 1988, República Natural, Vt Cosmetics, Vt Cosmetics, K-secret Seúl 1988, República Natural, Mira todas las categorias","hasta el jueves, 9 de abril de 2026 6:00 cosméticos coreanos medicube es una popular marca de k-beauty que ofrece resultados clínicamente probados a través de tecnología de belleza innovadora. añadir a mis favoritos y recibir una alerta",2026-04-05 11:10:56
899472,https://es.privalia.com/gr/catalog/899472,142,102,La cama de tus sueños Ropa de cama y complementos para el hogar,"Juegos de sábanas, Ropa de cama, Fundas nórdicas lisas y minimal, Bajeras, Colchas, Fundas de almohada, Fundas nórdicas estampadas, Rellenos, edredones y cubrecanapés, Todos los productos disponibles, Baño, Toallas - 500 g/m², Toallas Diamond - 600 g/m², Toallas de playa, Albornoces, Alfombras y cortinas, Albornoces - infantiles, Toallas microfibra, Todos los productos disponibles, Decoración y textil, Fundas y rellenos de cojín, Manta y plaid multiusos, Cubresofás y cortinas, Para la colada, Todos los productos disponibles, Cocina, Ropa de cama, Fundas nórdicas lisas y minimal, Bajeras, Colchas, Fundas de almohada, Fundas nórdicas estampadas, Rellenos, edredones y cubrecanapés, Todos los productos disponibles, Baño, Toallas - 500 g/m², Toallas Diamond - 600 g/m², Toallas de playa, Albornoces, Alfombras y cortinas, Albornoces - infantiles, Toallas microfibra, Todos los productos disponibles, Decoración y textil, Fundas y rellenos de cojín, Manta y plaid multiusos, Cubresofás y cortinas, Para la colada, Todos los productos disponibles, Cocina, Ropa de cama, Fundas nórdicas lisas y minimal, Bajeras, Colchas, Fundas de almohada, Fundas nórdicas estampadas, Rellenos, edredones y cubrecanapés, Todos los productos disponibles, Baño, Toallas - 500 g/m², Toallas Diamond - 600 g/m², Toallas de playa, Albornoces, Alfombras y cortinas, Albornoces - infantiles, Toallas microfibra, Todos los productos disponibles, Decoración y textil, Fundas y rellenos de cojín, Manta y plaid multiusos, Cubresofás y cortinas, Para la colada, Todos los productos disponibles, Cocina, Ropa de cama, Fundas nórdicas lisas y minimal, Fundas nórdicas estampadas, Fundas de almohada, Colchas, Bajeras, Rellenos, edredones y cubrecanapés, Mira todas las categorias","hasta el jueves, 9 de abril de 2026 6:00 ropa de cama y complementos para el hogar stilia ,javier larranzair, gamusi: ropa de cama de alta calidad. añadir a mis favoritos y recibir una alerta",2026-04-05 11:10:56
900753,https://es.privalia.com/gr/catalog/900753,132,89,Muare Estilo y artesanía textil de SG que visten tu hogar.,"Summer Vibes, Manteles antimanchas resinados, Nórdicos, Florales, Lisos y Vichys, Todos los productos disponibles, Complementos, Packs de 4 servilletas, Manteles individuales, Fundas de cojín cuadradas, Packs de paños de cocina, Fundas de cojín rectangulares, Caminos de mesa, Todos los productos disponibles, Manteles redondos antimanchas, Nórdicos y lisos, Florales, Todos los productos disponibles, Últimas oportunidades, Manteles antimanchas resinados, Paños de cocina, servilletas y delantales, Manteles individuales y caminos de mesa, Manteles redondos y XL, Todos los productos disponibles, Cojines de silla y asiento, Cojines para asiento, Cojines para silla, Todos los productos disponibles, Manteles XL antimanchas, Camas para mascota, Manteles antimanchas resinados, Nórdicos, Florales, Lisos y Vichys, Todos los productos disponibles, Complementos, Packs de 4 servilletas, Manteles individuales, Fundas de cojín cuadradas, Packs de paños de cocina, Fundas de cojín rectangulares, Caminos de mesa, Todos los productos disponibles, Manteles redondos antimanchas, Nórdicos y lisos, Florales, Todos los productos disponibles, Últimas oportunidades, Manteles antimanchas resinados, Paños de cocina, servilletas y delantales, Manteles individuales y caminos de mesa, Manteles redondos y XL, Todos los productos disponibles, Cojines de silla y asiento, Cojines para asiento, Cojines para silla, Todos los productos disponibles, Manteles XL antimanchas, Camas para mascota, Manteles antimanchas resinados, Nórdicos, Florales, Lisos y Vichys, Todos los productos disponibles, Complementos, Packs de 4 servilletas, Manteles individuales, Fundas de cojín cuadradas, Packs de paños de cocina, Fundas de cojín rectangulares, Caminos de mesa, Todos los productos disponibles, Manteles redondos antimanchas, Nórdicos y lisos, Florales, Todos los productos disponibles, Últimas oportunidades, Manteles antimanchas resinados, Paños de cocina, servilletas y delantales, Manteles individuales y caminos de mesa, Manteles redondos y XL, Todos los productos disponibles, Cojines de silla y asiento, Cojines para asiento, Cojines para silla, Todos los productos disponibles, Manteles XL antimanchas, Camas para mascota, Manteles antimanchas resinados, Florales, Nórdicos, Lisos y Vichys, Mira todas las categorias","hasta el viernes, 10 de abril de 2026 6:00 estilo y artesanía textil de sg que visten tu hogar. muare home by sg es una firma española especializada en mantelería y accesorios textiles antimanchas, confeccionados íntegramente en españa con tejido de algodón y tratamientos exclusivos. sus colecciones —inspiradas en la creatividad del jacquard y la artesanía local— aportan estilo, funcionalidad y calidad en cada pieza. añadir a mis favoritos y recibir una alerta",2026-04-05 11:10:56
897914,https://es.privalia.com/gr/catalog/897914,93,25,Art,"Sandalias planas, Sandalias de cuña, Bailarinas, Sandalias de tacón, Sandalias de cuña, Bailarinas, Sandalias de tacón, Sandalias de cuña, Bailarinas, Sandalias de tacón, Sandalias de cuña, Sandalias de tacón, Bailarinas, Mira todas las categorias","hasta el miércoles, 8 de abril de 2026 6:00 art art propone en sus colecciones un espíritu joven e inconformista. el naturalista destaca por sus zapatos cómodos y llenos de colorido. los zapatos están diseñados por un equipo de artesanos y fabricantes con años de experiencia en la industria del calzado. añadir a mis favoritos y recibir una alerta",2026-04-05 11:10:56
901819,https://es.privalia.com/gr/catalog/901819,167,65,McGregor Ropa y ropa interior para hombre,"Polos, Hombre, Camisas, Jerséis, sudaderas y cárdigans, Camisetas, Pantalones, jeans y bermudas, Chaquetas, chaquetas bomber y chalecos, Cinturones, Últimas oportunidades, Todos los productos disponibles, Mujer, Hombre, Camisas, Jerséis, sudaderas y cárdigans, Camisetas, Pantalones, jeans y bermudas, Chaquetas, chaquetas bomber y chalecos, Cinturones, Últimas oportunidades, Todos los productos disponibles, Mujer, Todos los productos disponibles, Hombre, Camisas, Jerséis, sudaderas y cárdigans, Camisetas, Pantalones, jeans y bermudas, Chaquetas, chaquetas bomber y chalecos, Cinturones, Últimas oportunidades, Todos los productos disponibles, Mujer, Todos los productos disponibles, McGregor, Hombre, Camisas, Camisetas, Pantalones, jeans y bermudas, Jerséis, sudaderas y cárdigans, Chaquetas, chaquetas bomber y chalecos, Cinturones, Últimas oportunidades, Mira todas las categorias","hasta el miércoles, 8 de abril de 2026 6:00 ropa y ropa interior para hombre ropa deportiva masculina neoyorquina con influencias europeas. conoce a mcgregor. fundada por david d. doniger, un inmigrante escocés de nueva york. su visión de lo mejor de ambos mundos le ha permitido alcanzar un gran éxito y reconocimiento. añadir a mis favoritos y recibir una alerta",2026-04-05 11:10:56
896732,https://es.privalia.com/gr/catalog/896732,232,102,Exé Shoes Calzado con estilo y carácter,"Sandalias planas, Sandalias de tacón alto, Sandalias de tacón medio, Sneakers, Sandalias de cuña y plataforma, Zapatos de tacón, - Be Free -, Bailarinas, Bolsos, Sandalias de tacón alto, Sandalias de tacón medio, Sneakers, Sandalias de cuña y plataforma, Zapatos de tacón, - Be Free -, Bailarinas, Bolsos, Sandalias de tacón alto, Sandalias de tacón medio, Sneakers, Sandalias de cuña y plataforma, Zapatos de tacón, - Be Free -, Bailarinas, Bolsos, Sandalias de tacón alto, Sandalias de tacón medio, Sandalias de cuña y plataforma, Zapatos de tacón, - Be Free -, Bailarinas, Sneakers, Bolsos, Mira todas las categorias","hasta el martes, 7 de abril de 2026 6:00 calzado con estilo y carácter botines modernos con un aire atrevido: colores vibrantes, detalles únicos y la comodidad que acompaña tu ritmo diario. añadir a mis favoritos y recibir una alerta",2026-04-05 11:10:56
903664,https://es.privalia.com/gr/catalog/903664,82,22,Bears with Benefits Ositos con Beneficios: ¡ositos de goma para tu bienestar!,"Para el metabolismo y la mujer, Imprescindible para la primavera, Para el bienestar y la salud, Para la piel y el pelo, Imprescindible para la primavera, Para el bienestar y la salud, Para la piel y el pelo, Imprescindible para la primavera, Para el bienestar y la salud, Para la piel y el pelo, Imprescindible para la primavera, Para el bienestar y la salud, Para la piel y el pelo, Mira todas las categorias","hasta el martes, 7 de abril de 2026 6:00 ositos con beneficios: ¡ositos de goma para tu bienestar! ya sea un cabello hermoso, una piel radiante o un brillo hermoso, los ositos de goma bears with benefits ofrecen una variedad de complejos vitamínicos de belleza para todos los días y cada necesidad de belleza, combinando la investigación farmacéutica con la naturalidad y una actitud positiva y sostenible hacia la vida. añadir a mis favoritos y recibir una alerta",2026-04-05 11:10:56
896996,https://es.privalia.com/gr/catalog/896996,215,189,Mango MANGO: moda de tendencia para mujeres,"Flared y Mom, Jeans, Straight y barrel, Wide Leg, Skinny y shorts, Todos los productos disponibles, Total Look, Tops, Vestidos largos y monos, Camisetas, Jerséis y cárdigans, Pantalones, Blusas y camisas, Calzado, Chaquetas y cazadoras, Party & events, Faldas y shorts, Vestidos cortos, Bolsos y monederos, Maternity, Jeans, Straight y barrel, Wide Leg, Skinny y shorts, Todos los productos disponibles, Total Look, Tops, Vestidos largos y monos, Camisetas, Jerséis y cárdigans, Pantalones, Blusas y camisas, Calzado, Chaquetas y cazadoras, Party & events, Faldas y shorts, Vestidos cortos, Bolsos y monederos, Maternity, Jeans, Straight y barrel, Wide Leg, Skinny y shorts, Todos los productos disponibles, Total Look, Tops, Vestidos largos y monos, Camisetas, Jerséis y cárdigans, Pantalones, Blusas y camisas, Calzado, Chaquetas y cazadoras, Party & events, Faldas y shorts, Vestidos cortos, Bolsos y monederos, Maternity, Jeans, Wide Leg, Straight y barrel, Skinny y shorts, Mira todas las categorias","hasta el miércoles, 8 de abril de 2026 6:00 mango: moda de tendencia para mujeres mango, firma española caracterizada por la creación de prendas de calidad que representan las últimas tendencias. la diversidad en cada una de sus colecciones acerca a la marca a un público global. añadir a mis favoritos y recibir una alerta",2026-04-05 11:10:56
898171,https://es.privalia.com/gr/catalog/898171,100,55,"Stor Planet Estores, cortinas y alfombras","Noche y día y translúcidos, Estores sin taladrar Mini, Screen solar y opacos, Todos los productos disponibles, Estores Screen solar térmicos, Estores Screen, Estores Screen motorizados, Estores Screen sin taladrar, Estores Screen XXL, Todos los productos disponibles, Estores enrollables translúcidos, Enrollables translúcidos, Enrollables motorizados, Todos los productos disponibles, Cortinas y barras, Cortinas confeccionadas, Barras de metal, Todos los productos disponibles, Estores noche y día, Estores Noche & Día, Estores Noche & Día sin taladrar, Estores Noche & Día motorizados, Todos los productos disponibles, Estores enrollables opacos, Enrollables opacos térmicos, Enrollables Opacos sin taladrar, Enrollables opacos motorizados, Todos los productos disponibles, Persianas venecianas y paquetos, Persianas y bambú, Estores paquetos, Todos los productos disponibles, Alfombras, Pasilleras, cocina y baño, Salón y dormitorio, Multiespacio, Todos los productos disponibles, Estores sin taladrar Mini, Screen solar y opacos, Todos los productos disponibles, Estores Screen solar térmicos, Estores Screen, Estores Screen motorizados, Estores Screen sin taladrar, Estores Screen XXL, Todos los productos disponibles, Estores enrollables translúcidos, Enrollables translúcidos, Enrollables motorizados, Todos los productos disponibles, Cortinas y barras, Cortinas confeccionadas, Barras de metal, Todos los productos disponibles, Estores noche y día, Estores Noche & Día, Estores Noche & Día sin taladrar, Estores Noche & Día motorizados, Todos los productos disponibles, Estores enrollables opacos, Enrollables opacos térmicos, Enrollables Opacos sin taladrar, Enrollables opacos motorizados, Todos los productos disponibles, Persianas venecianas y paquetos, Persianas y bambú, Estores paquetos, Todos los productos disponibles, Alfombras, Pasilleras, cocina y baño, Salón y dormitorio, Multiespacio, Todos los productos disponibles, Estores sin taladrar Mini, Screen solar y opacos, Todos los productos disponibles, Estores Screen solar térmicos, Estores Screen, Estores Screen motorizados, Estores Screen sin taladrar, Estores Screen XXL, Todos los productos disponibles, Estores enrollables translúcidos, Enrollables translúcidos, Enrollables motorizados, Todos los productos disponibles, Cortinas y barras, Cortinas confeccionadas, Barras de metal, Todos los productos disponibles, Estores noche y día, Estores Noche & Día, Estores Noche & Día sin taladrar, Estores Noche & Día motorizados, Todos los productos disponibles, Estores enrollables opacos, Enrollables opacos térmicos, Enrollables Opacos sin taladrar, Enrollables opacos motorizados, Todos los productos disponibles, Persianas venecianas y paquetos, Persianas y bambú, Estores paquetos, Todos los productos disponibles, Alfombras, Pasilleras, cocina y baño, Salón y dormitorio, Multiespacio, Todos los productos disponibles, Estores sin taladrar Mini, Screen solar y opacos, Mira todas las categorias","hasta el martes, 7 de abril de 2026 6:00 estores, cortinas y alfombras desde 1980, hemos sido pioneros en facilitar a las personas la mejora del entorno donde viven, suministrándoles nuestros productos a través de las distintas formas de distribución moderna. nuestro esfuerzo innovador ha adecuado nuestra oferta de manera continuada, siguiendo las tendencias del mercado y ofreciendo diferentes opciones. añadir a mis favoritos y recibir una alerta",2026-04-05 11:10:56
903206,https://es.privalia.com/gr/catalog/903206,94,27,"Masqmai Cosméticos Cruelty Free, fórmulas altamente eficaces","Cuidado facial y capilar, Make up, Make up, Make up, Make up, Mira todas las categorias","hasta el martes, 7 de abril de 2026 6:00 cosméticos cruelty free, fórmulas altamente eficaces descubre productos de cosmética natural, formulados con ingredientes puros y de alta eficacia.",2026-04-05 11:10:56
902438,https://es.privalia.com/gr/catalog/902438,147,73,Creaciones Selene,"Reductores y envolventes, Clásicos y elegantes, Braguitas, Braguitas y tangas, Corte láser, Fajas y reductoras, Todos los productos disponibles, Bralettes y sin aros, Push up - simple, doble y triple, Deportivos, Multiposición y bandeau, Bodis, Maternales y post-quirúrgicos, Clásicos y elegantes, Braguitas, Braguitas y tangas, Corte láser, Fajas y reductoras, Todos los productos disponibles, Bralettes y sin aros, Push up - simple, doble y triple, Deportivos, Multiposición y bandeau, Bodis, Maternales y post-quirúrgicos, Clásicos y elegantes, Braguitas, Braguitas y tangas, Corte láser, Fajas y reductoras, Todos los productos disponibles, Bralettes y sin aros, Push up - simple, doble y triple, Deportivos, Multiposición y bandeau, Bodis, Maternales y post-quirúrgicos, Clásicos y elegantes, Push up - simple, doble y triple, Bralettes y sin aros, Multiposición y bandeau, Deportivos, Maternales y post-quirúrgicos, Braguitas, Bodis, Mira todas las categorias","hasta el miércoles, 8 de abril de 2026 6:00 creaciones selene creación y pasión por la lencería. creaciones selene añadir a mis favoritos y recibir una alerta",2026-04-05 11:10:56
902652,https://es.privalia.com/gr/catalog/902652,143,91,Colchas de Verano,"Colchas lisas y básicas, Colchas boutí, Colchas estampadas, Fundas de almohada lisas y básicas, Fundas de almohada estampadas, Fundas de cojín, Todos los productos disponibles, Ropa de cama, Fundas de almohada rectangulares, Fundas nórdicas, Fundas de almohada cuadradas, Fundas de cojín, Todos los productos disponibles, Bajeras y juegos de sábanas, Sábanas bajeras, Juegos de sábanas, Todos los productos disponibles, Esenciales del hogar, Rellenos nórdicos y de cojín, Manteles antimanchas, Baño, Mantas, Todos los productos disponibles, Colchas boutí, Colchas estampadas, Fundas de almohada lisas y básicas, Fundas de almohada estampadas, Fundas de cojín, Todos los productos disponibles, Ropa de cama, Fundas de almohada rectangulares, Fundas nórdicas, Fundas de almohada cuadradas, Fundas de cojín, Todos los productos disponibles, Bajeras y juegos de sábanas, Sábanas bajeras, Juegos de sábanas, Todos los productos disponibles, Esenciales del hogar, Rellenos nórdicos y de cojín, Manteles antimanchas, Baño, Mantas, Todos los productos disponibles, Colchas boutí, Colchas estampadas, Fundas de almohada lisas y básicas, Fundas de almohada estampadas, Fundas de cojín, Todos los productos disponibles, Ropa de cama, Fundas de almohada rectangulares, Fundas nórdicas, Fundas de almohada cuadradas, Fundas de cojín, Todos los productos disponibles, Bajeras y juegos de sábanas, Sábanas bajeras, Juegos de sábanas, Todos los productos disponibles, Esenciales del hogar, Rellenos nórdicos y de cojín, Manteles antimanchas, Baño, Mantas, Todos los productos disponibles, Colchas boutí, Colchas estampadas, Fundas de almohada lisas y básicas, Fundas de almohada estampadas, Fundas de cojín, Mira todas las categorias","hasta el martes, 7 de abril de 2026 6:00 colchas de verano viste tu hogar como siempre has soñado, con las últimas tendencias y la mayor calidad. colores mediterráneos, naturales y que harán que tu hogar brille con luz propia. añadir a mis favoritos y recibir una alerta",2026-04-05 11:10:56
901149,https://es.privalia.com/gr/catalog/901149,160,108,Sia,"Sillas de colores claros, Sillas y taburetes altos, Sillas en tonos vivos, Sillas en tonos oscuros, Taburetes altos, Todos los productos disponibles, Mesas y consolas de salón, Mesas de comedor extensibles, Mesitas de noche y mesitas auxiliares, Mesas de centro, Aparadores y muebles de TV, Mesas de comedor fijas, Consolas de salón y estanterías, Todos los productos disponibles, Sillones, Alfombras, Espejos, Sofás de exterior, Sofás fijos, Sofás rectos convertibles, Pufs y chaise longue, Sofás esquineros convertibles, Sofás esquineros fijos, Sofás panorámicos y gran angular fijos, Sillas y taburetes altos, Sillas en tonos vivos, Sillas en tonos oscuros, Taburetes altos, Todos los productos disponibles, Mesas y consolas de salón, Mesas de comedor extensibles, Mesitas de noche y mesitas auxiliares, Mesas de centro, Aparadores y muebles de TV, Mesas de comedor fijas, Consolas de salón y estanterías, Todos los productos disponibles, Sillones, Alfombras, Espejos, Sofás de exterior, Sofás fijos, Sofás rectos convertibles, Pufs y chaise longue, Sofás esquineros convertibles, Sofás esquineros fijos, Sofás panorámicos y gran angular fijos, Sillas y taburetes altos, Sillas en tonos vivos, Sillas en tonos oscuros, Taburetes altos, Todos los productos disponibles, Mesas y consolas de salón, Mesas de comedor extensibles, Mesitas de noche y mesitas auxiliares, Mesas de centro, Aparadores y muebles de TV, Mesas de comedor fijas, Consolas de salón y estanterías, Todos los productos disponibles, Sillones, Alfombras, Espejos, Sofás de exterior, Sofás fijos, Sofás rectos convertibles, Pufs y chaise longue, Sofás esquineros convertibles, Sofás esquineros fijos, Sofás panorámicos y gran angular fijos, Sillas y taburetes altos, Sillas en tonos vivos, Sillas en tonos oscuros, Taburetes altos, Mira todas las categorias","hasta el lunes, 13 de abril de 2026 6:00 la marca sia home es reconocida en el mundo del diseño de interiores por su fidelidad al espíritu de su fundador: creaciones que capturan el espíritu de la época sin sucumbir a las tendencias pasajeras. creaciones impregnadas de espontaneidad, poesía y frescura. añadir a mis favoritos y recibir una alerta",2026-04-05 11:10:56
